{
  "issue": 44,
  "issue_url": "https://github.com/toshikimiyagawa/ai-sdd-guide/issues/44",
  "feature": "traceability-format",
  "entries": [
    {
      "issue_ac": "44-AC1",
      "spec_ac": "SAC-1",
      "task": "T1",
      "test": "tests/test_traceability_schema.py::test_schema_file_exists",
      "status": "in-scope"
    },
    {
      "issue_ac": "44-AC2",
      "spec_ac": "SAC-2",
      "task": "T4",
      "test": "tests/test_traceability_schema.py::test_docs_naming_convention",
      "status": "in-scope"
    },
    {
      "issue_ac": "44-AC3",
      "spec_ac": "SAC-3",
      "task": "T1",
      "test": "tests/test_traceability_schema.py::test_out_of_scope_missing_followup_issue_fails",
      "status": "in-scope"
    },
    {
      "issue_ac": "44-AC4",
      "spec_ac": "SAC-4",
      "task": "T3",
      "test": "tests/test_traceability_schema.py::test_example_is_schema_valid",
      "status": "in-scope"
    },
    {
      "issue_ac": "44-AC5",
      "spec_ac": "SAC-5",
      "task": "T1",
      "test": "tests/test_traceability_schema.py::test_schema_file_exists",
      "status": "in-scope"
    }
  ]
}
