{
  "issue": 54,
  "issue_url": "https://github.com/toshikimiyagawa/ai-sdd-guide/issues/54",
  "feature": "evidence-validation",
  "entries": [
    {
      "issue_ac": "54-AC1",
      "spec_ac": "SAC-1",
      "task": "T1",
      "test": "tests/test_evidence_schema.py::test_valid_evidence_passes_schema",
      "status": "in-scope"
    },
    {
      "issue_ac": "54-AC2",
      "spec_ac": "SAC-2",
      "task": "T1",
      "test": "tests/test_evidence_schema.py::test_non_test_entry_with_test_count_fails_schema",
      "status": "in-scope"
    },
    {
      "issue_ac": "54-AC3",
      "spec_ac": "SAC-3",
      "task": "T1",
      "test": "tests/test_evidence_schema.py::test_test_entry_missing_test_count_fails_schema",
      "status": "in-scope"
    },
    {
      "issue_ac": "54-AC4",
      "spec_ac": "SAC-4",
      "task": "T1",
      "test": "tests/test_evidence_schema.py::test_invalid_commit_sha_fails_schema",
      "status": "in-scope"
    },
    {
      "issue_ac": "54-AC5",
      "spec_ac": "SAC-5",
      "task": "T2",
      "test": "tests/test_sdd_validate.py::test_check_evidence_valid_existing_commit",
      "status": "in-scope"
    },
    {
      "issue_ac": "54-AC6",
      "spec_ac": "SAC-6",
      "task": "T3",
      "test": "tests/test_sdd_validate.py::test_check_evidence_missing_fails_closed",
      "status": "in-scope"
    }
  ]
}
